id,sessionId,timestamp,agentId,agentName,summary,topicTags,stance,contributionType,status
evt-001,oasis-panel-2026-07-10,2026-07-10T09:02:00-06:00,interaction-agent,Interaction Agent,Opened the session by asking which discussion records should be publishable to the website.,"open-science,agent-governance",clarification,question,newly raised
evt-002,oasis-panel-2026-07-10,2026-07-10T09:06:00-06:00,citation-curator,Citation and Evidence Curator,Proposed that every factual claim promoted to the site must link to evidence or be marked as speculation.,"evidence-traceability,open-science",agree,proposal,
evt-003,oasis-panel-2026-07-10,2026-07-10T09:10:00-06:00,scientific-director,Scientific Director,Agreed that traceability should be a first-class panel norm because it lets readers separate evidence from synthesis.,evidence-traceability,agree,norm,accepted
evt-004,oasis-panel-2026-07-10,2026-07-10T09:14:00-06:00,skeptic,Skeptic,Warned that citation density can create false confidence if evidence quality is not assessed.,"evidence-traceability,data-quality",clarification,claim,
evt-005,oasis-panel-2026-07-10,2026-07-10T09:19:00-06:00,data-engineer,Data Engineer,"Identified sampling gaps, inconsistent metadata, and inconsistent taxonomies as immediate blockers for ecological AI workflows.",data-quality,neutral,evidence,
evt-006,oasis-panel-2026-07-10,2026-07-10T09:24:00-06:00,domain-scientist,Domain Scientist,Asked whether foundation models are discovering ecological mechanisms or mostly interpolating known observational patterns.,"foundation-models,model-interpretability",unresolved,question,actively discussed
evt-007,oasis-panel-2026-07-10,2026-07-10T09:29:00-06:00,quant-modeler,Quantitative Modeler,"Argued that foundation models can be useful discovery tools if evaluation includes transfer, perturbation tests, and counterfactual checks.","foundation-models,benchmarks",agree,claim,
evt-008,oasis-panel-2026-07-10,2026-07-10T09:34:00-06:00,skeptic,Skeptic,Disagreed that benchmark performance alone should be treated as evidence of ecological discovery.,"foundation-models,benchmarks,model-interpretability",disagree,claim,
evt-009,oasis-panel-2026-07-10,2026-07-10T09:39:00-06:00,societal-impact,Societal Impact Translator,Raised concern that benchmark choices can privilege well-instrumented ecosystems and marginalize community-held knowledge.,"benchmarks,ai-ethics,data-quality",disagree,claim,
evt-010,oasis-panel-2026-07-10,2026-07-10T09:44:00-06:00,scientific-director,Scientific Director,"Proposed that benchmark governance should include domain experts, data stewards, and community review where data sovereignty is relevant.","benchmarks,ai-ethics,open-science",agree,proposal,
evt-011,oasis-panel-2026-07-10,2026-07-10T09:48:00-06:00,narrative-lead,Scientific Narrative Lead,Summarized the split: benchmarks are necessary for comparison but insufficient as a definition of discovery.,"benchmarks,foundation-models",neutral,summary,
evt-012,oasis-panel-2026-07-10,2026-07-10T09:52:00-06:00,interaction-agent,Interaction Agent,Queued a follow-up discussion on how to score interpretability without overclaiming mechanism.,"model-interpretability,future-work",unresolved,action,deferred
evt-013,oasis-panel-2026-07-10,2026-07-10T09:57:00-06:00,data-engineer,Data Engineer,Mentioned remote sensing as a useful source for repeated observation but noted the panel had not yet scoped sensor bias.,"remote-sensing,data-quality",neutral,claim,
evt-014,oasis-panel-2026-07-10,2026-07-10T10:01:00-06:00,citation-curator,Citation and Evidence Curator,Flagged remote sensing as low engagement rather than low importance and requested evidence packets before conclusions.,"remote-sensing,evidence-traceability",clarification,action,needs evidence
evt-015,oasis-panel-2026-07-10,2026-07-10T10:06:00-06:00,scientific-director,Scientific Director,Confirmed a decision to publish a latest-discussion brief only after human review and clear labels for synthetic panel content.,"open-science,agent-governance",agree,decision,accepted
evt-016,oasis-panel-2026-07-10,2026-07-10T10:10:00-06:00,societal-impact,Societal Impact Translator,Proposed preserving minority viewpoints in public summaries so disagreement is treated as useful scientific information.,"ai-ethics,open-science",agree,norm,accepted
evt-017,oasis-panel-2026-07-10,2026-07-10T10:14:00-06:00,skeptic,Skeptic,Supported the minority-view norm and added that repeated arguments should not be counted as new evidence.,"ai-ethics,evidence-traceability",agree,norm,accepted
evt-018,oasis-panel-2026-07-10,2026-07-10T10:18:00-06:00,quant-modeler,Quantitative Modeler,Asked for a future comparison of ecological foundation-model claims against classical mechanistic baselines.,"foundation-models,model-interpretability,future-work",unresolved,question,needs evidence
evt-019,oasis-panel-2026-07-10,2026-07-10T10:22:00-06:00,domain-scientist,Domain Scientist,Proposed an action item to define three ecological mechanism examples before the next foundation-model round.,"foundation-models,model-interpretability",agree,action,proposed
evt-020,oasis-panel-2026-07-10,2026-07-10T10:25:00-06:00,data-engineer,Data Engineer,Mentioned agent governance briefly as a logging and approval problem but the panel did not develop it further.,agent-governance,neutral,claim,
evt-021,oasis-panel-2026-07-10,2026-07-10T10:29:00-06:00,interaction-agent,Interaction Agent,Marked agent governance as a low-engagement topic that should return when automation or publishing permissions change.,"agent-governance,future-work",clarification,summary,deferred
evt-022,oasis-panel-2026-07-10,2026-07-10T10:32:00-06:00,narrative-lead,Scientific Narrative Lead,Closed with a public-facing summary: evidence traceability is settled for now; benchmark governance and foundation-model interpretation need more work.,"open-science,evidence-traceability,benchmarks,foundation-models",neutral,summary,
